{
  "schema_version": "1.1",
  "task_id": "feature-ui-001",
  "visual_task": true,
  "changed_files": [
    "src/pages/Example.tsx"
  ],
  "reuse_decisions": [],
  "responsive": {
    "status": "VERIFIED",
    "evidence": [
      "viewport checks"
    ]
  },
  "accessibility": {
    "status": "VERIFIED",
    "evidence": [
      "semantic and keyboard checks"
    ]
  },
  "states": {
    "status": "VERIFIED",
    "covered": [
      "loading",
      "empty",
      "error",
      "success"
    ]
  },
  "interaction": {
    "status": "VERIFIED",
    "evidence": [
      "interaction behavior checked"
    ]
  },
  "exceptions": [],
  "phase6_review_path": ".aledevos/state/uxui/phase6/reviews/feature-example.json"
}
